{
  "schema": "boe.mtt.full-graded-augmented-heterotic-symbol-parametrix.v1",
  "claim_id": "CBF.T58",
  "date": "2026-09-01",
  "status": "EXACT_FULL_GRADED_PROJECTOR_SYMBOL_PARAMETRIX_DETERMINANT_AND_LEADING_HEAT_TRACE_CONDITIONAL_Q79_SOURCE_REDUCTION",
  "source_provenance": {
    "model_state_sha256": "f92c7c23388a1de1076e33b2f18ca97c689cc5c9c66340678238c86e8573e1a1",
    "handoff_id": "8a0a6626-8f9b-4377-b969-5c6f610664dd",
    "source_checks": [
      {
        "id": "T57_THEOREM",
        "path": "AugmentedHeteroticTriangularPrincipalSymbolMetricRecoveryTheorem_v1.md",
        "expected_sha256": "4405b98495a95a5b07fda6daf9b017c93f77a85b9cc966a750f0e28f27de6ed4",
        "actual_sha256": "4405b98495a95a5b07fda6daf9b017c93f77a85b9cc966a750f0e28f27de6ed4",
        "matches": true
      },
      {
        "id": "T57_PACKET",
        "path": "augmented_heterotic_triangular_principal_symbol.packet.json",
        "expected_sha256": "df10db3c12a46db5769ef22cf65c3ccdc1d936518c4f709518c5737daf30f93e",
        "actual_sha256": "df10db3c12a46db5769ef22cf65c3ccdc1d936518c4f709518c5737daf30f93e",
        "matches": true
      },
      {
        "id": "T57_BUILDER",
        "path": "build_augmented_heterotic_triangular_principal_symbol.py",
        "expected_sha256": "98322117852bbcf62a4abb45d6bd865b48f519330a8fe860f8e5642499950aab",
        "actual_sha256": "98322117852bbcf62a4abb45d6bd865b48f519330a8fe860f8e5642499950aab",
        "matches": true
      },
      {
        "id": "T57_INDEPENDENT_VERIFIER",
        "path": "verify_augmented_heterotic_triangular_principal_symbol.py",
        "expected_sha256": "54a4912e703c7497a28795d6f419c8ea9fac86622cb19257eca3899ac6af125c",
        "actual_sha256": "54a4912e703c7497a28795d6f419c8ea9fac86622cb19257eca3899ac6af125c",
        "matches": true
      }
    ],
    "all_sources_hash_locked": true
  },
  "full_graded_theorem": {
    "degrees": [
      -1,
      0,
      1,
      2,
      3
    ],
    "carrier_dimension_formula": "d_n=r*C(3,n)+C(3,n+1)",
    "correction_rank_formula": "s_n=C(3,n)+C(3,n+1)=C(4,n+1)",
    "correction_ranks": [
      1,
      4,
      6,
      4,
      1
    ],
    "symbol_formula": "sigma_2(Delta_Y,n)(xi)=q(xi)[I+cP_n], c=a^2 rho",
    "inverse_formula": "q^(-1)[I-c/(1+c)P_n]",
    "condition_number": "1+c",
    "determinant_formula": "q^(d_n)(1+c)^(s_n)",
    "leading_heat_weight": "h_n(c)=(d_n-s_n)+s_n(1+c)^(-3)",
    "strong_ellipticity_for_positive_q_and_rho": true,
    "principal_inverse_is_not_global_reduced_Green": true,
    "degree_minus_one_scalar_completion_is_required": true
  },
  "exact_non_diagonal_witness": {
    "Q_rank": 4,
    "a_fixture": "1/2",
    "rho_fixture": "1",
    "c_fixture": "1/4",
    "fixtures_are_physical": false,
    "degree_rows": [
      {
        "degree": -1,
        "carrier_dimension": 1,
        "correction_rank": 1,
        "baseline_multiplicity": 0,
        "elevated_multiplicity": 1,
        "normalized_trace_factor_rho_one": "5/4",
        "condition_number_rho_one": "5/4",
        "leading_heat_weight_rho_one": "64/125"
      },
      {
        "degree": 0,
        "carrier_dimension": 7,
        "correction_rank": 4,
        "baseline_multiplicity": 3,
        "elevated_multiplicity": 4,
        "normalized_trace_factor_rho_one": "8/7",
        "condition_number_rho_one": "5/4",
        "leading_heat_weight_rho_one": "631/125"
      },
      {
        "degree": 1,
        "carrier_dimension": 15,
        "correction_rank": 6,
        "baseline_multiplicity": 9,
        "elevated_multiplicity": 6,
        "normalized_trace_factor_rho_one": "11/10",
        "condition_number_rho_one": "5/4",
        "leading_heat_weight_rho_one": "1509/125"
      },
      {
        "degree": 2,
        "carrier_dimension": 13,
        "correction_rank": 4,
        "baseline_multiplicity": 9,
        "elevated_multiplicity": 4,
        "normalized_trace_factor_rho_one": "14/13",
        "condition_number_rho_one": "5/4",
        "leading_heat_weight_rho_one": "1381/125"
      },
      {
        "degree": 3,
        "carrier_dimension": 4,
        "correction_rank": 1,
        "baseline_multiplicity": 3,
        "elevated_multiplicity": 1,
        "normalized_trace_factor_rho_one": "17/16",
        "condition_number_rho_one": "5/4",
        "leading_heat_weight_rho_one": "439/125"
      }
    ],
    "record_count": 105,
    "records": [
      {
        "label": "e1",
        "row": 0,
        "column": null,
        "degree": -1,
        "covector": [
          "1",
          "0",
          "0",
          "0",
          "0",
          "0"
        ],
        "q": "7",
        "carrier_dimension": 1,
        "projector_rank": 1,
        "baseline_multiplicity": 0,
        "elevated_multiplicity": 1,
        "Hodge_symbol_sha256": "c1d9b1c07611fb60042997362976463d99f341076433be866d879e0b1873579d",
        "projector_sha256": "e28610836ab702cd35495751839961e9fae54fec4ee18dc4b314862c18c3d104",
        "inverse_symbol_sha256": "c4e38c0bd9f610ff452f337ae8ed3b04231b64228e0dd6d7911d452b1254ac5a",
        "projector_exact": true,
        "inverse_exact": true,
        "two_level_exact": true,
        "determinant": "35/4",
        "expected_determinant": "35/4",
        "determinant_exact": true,
        "trace": "35/4",
        "expected_trace": "35/4",
        "trace_exact": true
      },
      {
        "label": "e1",
        "row": 0,
        "column": null,
        "degree": 0,
        "covector": [
          "1",
          "0",
          "0",
          "0",
          "0",
          "0"
        ],
        "q": "7",
        "carrier_dimension": 7,
        "projector_rank": 4,
        "baseline_multiplicity": 3,
        "elevated_multiplicity": 4,
        "Hodge_symbol_sha256": "ec723e0c21ee2742fef35ec56cddaac9e461df0982d3bcb43cad07bf44ca2470",
        "projector_sha256": "fb9f78b4e5e5a152d84ee91e12f1bc0e284a701c34c355f72965d71cc20de590",
        "inverse_symbol_sha256": "83326a7604ece718435d63f856b1a7a0d4a2fc7ab1100e89ee1f6b6fa00ed436",
        "projector_exact": true,
        "inverse_exact": true,
        "two_level_exact": true,
        "determinant": "514714375/256",
        "expected_determinant": "514714375/256",
        "determinant_exact": true,
        "trace": "56",
        "expected_trace": "56",
        "trace_exact": true
      },
      {
        "label": "e1",
        "row": 0,
        "column": null,
        "degree": 1,
        "covector": [
          "1",
          "0",
          "0",
          "0",
          "0",
          "0"
        ],
        "q": "7",
        "carrier_dimension": 15,
        "projector_rank": 6,
        "baseline_multiplicity": 9,
        "elevated_multiplicity": 6,
        "Hodge_symbol_sha256": "a3d74f692c171f6e3b64bd3214785b041a274587d1f27be45b68bc1baec06b8a",
        "projector_sha256": "4a67fbfefe99c3ecec8365e3dd3e718495c1b7536f46d676c7df89215ba51f78",
        "inverse_symbol_sha256": "94e546e0cc1ce6b2d5b3d9830b88a648fbd7b02d911d97a5abc78297d81f401b",
        "projector_exact": true,
        "inverse_exact": true,
        "two_level_exact": true,
        "determinant": "74180648592859375/4096",
        "expected_determinant": "74180648592859375/4096",
        "determinant_exact": true,
        "trace": "231/2",
        "expected_trace": "231/2",
        "trace_exact": true
      },
      {
        "label": "e1",
        "row": 0,
        "column": null,
        "degree": 2,
        "covector": [
          "1",
          "0",
          "0",
          "0",
          "0",
          "0"
        ],
        "q": "7",
        "carrier_dimension": 13,
        "projector_rank": 4,
        "baseline_multiplicity": 9,
        "elevated_multiplicity": 4,
        "Hodge_symbol_sha256": "d465edb2c69af0c8ff68fabcd1e17d174108935d9103c855367e56704e227b5e",
        "projector_sha256": "6ce37e807904e95d288d7b77374a7e8cfb7a4e3ba732d4fa0dd75f3961005352",
        "inverse_symbol_sha256": "bafe2ac7fad7ea88aa8c988eb8b8e11be6c8635f70d488bedc31d42dc472b084",
        "projector_exact": true,
        "inverse_exact": true,
        "two_level_exact": true,
        "determinant": "60555631504375/256",
        "expected_determinant": "60555631504375/256",
        "determinant_exact": true,
        "trace": "98",
        "expected_trace": "98",
        "trace_exact": true
      },
      {
        "label": "e1",
        "row": 0,
        "column": null,
        "degree": 3,
        "covector": [
          "1",
          "0",
          "0",
          "0",
          "0",
          "0"
        ],
        "q": "7",
        "carrier_dimension": 4,
        "projector_rank": 1,
        "baseline_multiplicity": 3,
        "elevated_multiplicity": 1,
        "Hodge_symbol_sha256": "775f7eda303c11ecff01834c807c217b2aeb1064a810366aa5b818e7ccb96aa0",
        "projector_sha256": "92abc63e19e18af95bbf02d4efa8501c60d4a11a1194ca138a66c707bdf4f8f2",
        "inverse_symbol_sha256": "69119f730f0200cd66aefedbd39550c92d6a1d42874f02a2cdc7ca9a20747454",
        "projector_exact": true,
        "inverse_exact": true,
        "two_level_exact": true,
        "determinant": "12005/4",
        "expected_determinant": "12005/4",
        "determinant_exact": true,
        "trace": "119/4",
        "expected_trace": "119/4",
        "trace_exact": true
      },
      {
        "label": "e1+e2",
        "row": 0,
        "column": 1,
        "degree": -1,
        "covector": [
          "1",
          "1",
          "0",
          "0",
          "0",
          "0"
        ],
        "q": "14",
        "carrier_dimension": 1,
        "projector_rank": 1,
        "baseline_multiplicity": 0,
        "elevated_multiplicity": 1,
        "Hodge_symbol_sha256": "2d0ae3b03a7f0214ddf3add5609ad2d27204da4e1a7530ce60640ce554105de3",
        "projector_sha256": "e28610836ab702cd35495751839961e9fae54fec4ee18dc4b314862c18c3d104",
        "inverse_symbol_sha256": "76a820437e617c4354d03061156812a03422e932e11a6790dff730ca615705eb",